,title,topic
377,How to secure applications running on Kubernetes (SSL/TLS Certificates)?,programming
378,Reference Other Values in Helm Chart Values File,programming
379,Shell Scripting for DevOps with Examples,programming
380,Dockerize Angular Application,programming
381,Copy directories and files to and from Kubernetes Container [POD],programming
382,Top 35 Linux Console Tips and Tricks From Practical Experience | HackerNoon,programming
383,Switching from Docker Desktop to Podman on macOS M1/M2 ARM64 CPU,programming
384,CKS CKA CKAD changed Terminal to Remote Desktop,programming
385,A Step-by-Step Guide for your first 90 days as a Senior DevOps Engineer,programming
386,"Full Stack DevOps Environment Setup Bash Script for Ubuntu, CentOS and MacOS",programming
387,Why the fuss about conversational programming?,programming
388,How to manage Terraform state,programming
389,Build and run Angular application in a Docker container,programming
390,4 SSH Alternatives That Are Better Than The Original,programming
391,DevOps salaries: The complete rundown & how to get a raise (2022),programming
392,Testing Strategies For Microservices,programming
393,Generate AWS Architecture Diagrams,programming
394,Four Great Alternatives to HashiCorp’s Terraform Cloud,programming
395,Data engineers : Let’s build a data stack step by step,programming
396,How To Learn Kubernetes (Complete Roadmap & Resources),programming
397,How to create reusable infrastructure with Terraform modules,programming
398,Cron + Docker = The Easiest Job Scheduler You’ll Ever Create,programming
399,Visual studio code extensions for DevOps engineers,programming
400,Introduction to Docker — beginners,programming
401,Terraform — Best Practices,programming
402,How to deploy Angular app to an IIS Web server — Complete Setup,programming
403,ChatGPT for your Kubernetes Cluster — k8sgpt,programming
404,Blue-Green Deployment using Kubernetes,programming
405,Release Management for Microservices,programming
406,Kubernetes CI/CD Pipelines — Best Practices and Tools,programming
407,Pod rebalancing and allocations in Kubernetes,programming
408,How to Set Up Ingress Controller in AWS EKS,programming
409,Deep Dive into Kubernetes,programming
410,Kubernetes The Easy Way,programming
411,How to manage multiple environments with Terraform using branches,programming
412,Diagrams as Code in Python,programming
413,Import Existing AWS Infrastructure to Terraform,programming
414,Kubernetes Networking Visualized,programming
415,Become A DevOps Engineer in 2023: A Comprehensive Guide,programming
416,Fundamental TLS Certificate Commands You Should Know,programming
417,ERROR: x509: certificate signed by unknown authority error is returned,programming
418,10 Best DevOps Tools for Start-ups,programming
419,"The Docker, Kubernetes, Terraform, and AWS crash course series",programming
420,Best Alternatives for The Top Kubernetes IDE You Need to Know of,programming
421,10 Tiny Linux Tricks That Will Boost Your Productivity,programming
422,Database Management With CI/CD,programming
423,Crossplane: The Next Big Thing for Infrastructure as Code,programming
424,The Problem with Feature Branches,programming
425,Sapling by Meta: A Review of the New Version Control System,programming
426,10 Tasks for DevOps Engineers When There’s Nothing to Do,programming
427,Data Engineering — Week 1,programming
428,How To Successfully Implement A Healthcheck In Docker Compose,programming
429,"Terraform from 0 to Hero — 0. I like to start counting from 0, maybe I enjoy lists too much",programming
430,"Better Git branching strategy — Multi-apps, monorepos and multiple teams in focus — SimGit Flow",programming
431,Turning Kubernetes into a Developer-Friendly Product,programming
432,Build & Push Docker Image to AWS ECR using GitHub Actions,programming
433,"Terraform: Up & Running, 3rd edition is now published!",programming
434,Trunk-Based Development: The Key to Better and Faster Software,programming
435,How to automate repetitive tasks in Kubernetes with runbooks?,programming
436,Kubernetes YAML tips and tricks,programming
437,I tried… Using ChatGPT for FuNn as a DevOps Engineer,programming
438,Automated Troubleshooting of Kubernetes (K8s) Pods Issues,programming
439,Autoscaling Ingress controllers in Kubernetes,programming
440,How and when to ignore lifecycle changes in Terraform,programming
441,Learning how an ingress controller works by building one in bash,programming
442,DevOps Bulletin #85: What Every DevOps Should Learn in 2023,programming
443,"Feedback, Structure, and Direction: The Fundamentals of Team Leadership",programming
444,Opensource DevSecOps tools for DevOps engineers,programming
445,An Introduction to Terraform,programming
446,A crash course on Kubernetes,programming
447,DevOps — Advanced Linux Commands,programming
448,Becoming SRE,programming
449,"Lens 6 Released, Vision for the Future, New Subscription Model and Features Available",programming
450,Matured Dockerfile for Spring Boot,programming
451,Free Books that will Boost Your DevOps Game to the Next Level,programming
452,Streamlining Diagram Creation With Draw.io and GIT,programming
453,5 Free Cloud & DevOps Badges for your Resume in 2023,programming
454,Learn why you can’t ping a Kubernetes service,programming
455,Memory requests and limits in Kubernetes,programming
456,Advanced VIM — 7 Most Useful Commands you’d wish you’d known earlier,programming
457,Step-by-step guide how integrate Keycloak with Angular application,programming
458,5 Inbuilt Bash Variables That Every Developer Should Know,programming
459,How We Built an Infrastructure Platform on Top of Kubernetes,programming
460,Manage your terraform like a container,programming
