,title,topic
0,What Google’s Virtual Try-On Means For The Future Of Fashion,programming
1,Unpacking Prompt Engineering,programming
2,I’m an ER doctor. Here’s how I’m already using ChatGPT to help treat patients.,programming
3,The Waygate Release: A Novel 3D Blockchain Platform,programming
4,Delysium Dev-Note Q2 2023 —Harnessing the Power of AI for the Web3 Era: Introducing Delysium AI,programming
5,Meet the Fellow: Umang Bhatt,programming
6,Behind Falcon-40B’s Rise: The Story of Dominating the Open Source LLM Board!,programming
7,Avoiding Burnout During a Career Change into Data Science,programming
8,We Expect Humans To Be Accountable. We Should Expect No Less Of AI,programming
9,It’s time for dimensional thinking in design,programming
10,"ChatGPT has Banned Many Companies, 3 Big Reasons Why!",programming
11,PromptBench: The Litmus Test for Large Language Models,programming
12,Introducing Mojo: The end of Python!,programming
13,"AI has infiltrated every aspect of our lives, But 91% of people don’t know the fundamental AI terms.",programming
14,“AI is Far More Dangerous Than Nukes” — Elon Musk,programming
15,Introducing Voicebox (by Meta): The Most Versatile AI for Speech Generation,programming
16,How To Create Vector Graphics With Midjourney,programming
17,AI Brings Intimacy and Connectivity But Think About Environment Sustainability,programming
18,Can I Write Better than AI?,programming
19,Breaking Down Bias: Rethinking How We Evaluate Language Models,programming
20,How to Learn to Code FAST with AI-Powered Tools,programming
21,Chat GPT: My Surreal Conversation with Artificial Intelligence,programming
22,The Power Duo: Unifying Knowledge Graphs and Large Language Models for Better AI,programming
23,“The Dawn of a New Era: Unveiling the Futuristic Landscape of Artificial Intelligence and its Transformative Impacts”,programming
24,From Novice to Data Maestro: Empowering Data Science Skills with Chat GPT,programming
25,HOW TO USE BASLER INDUSTRIAL CAMERA IN PYTHON OPENCV,programming
26,Atomic unit of expression,programming
27,My AI Companion: Charting the Future,programming
28,HeyPi: the future of AI companionship that we’ll learn to crave,programming
29,5 Powerful Cross-Validation Methods to Skyrocket Robustness of Your ML Models,programming
30,Can AI communicate with us telepathically?,programming
31,Building a Vision Transformer from Scratch in PyTorch,programming
32,Debunking the Washington Post disinformation on Tesla FSD accidents,programming
33,Midjourney is DEAD. Use this AI tool instead.,programming
34,ChatGPT plugin reviews — #1,programming
35,Bill Gates: People Don’t Realize What’s Coming,programming
36,Coding Won’t Exist In 5 Years. This Is Why,programming
37,Bye-bye ChatGPT: AI Tools As Good As ChatGPT (But Few People Are Using Them),programming
38,5 ChatGPT features to boost your daily work,programming
39,Using ChatGPT to build System Diagrams — Part I,programming
40,How To Build Your Own Custom ChatGPT With Custom Knowledge Base,programming
41,Use Git like a senior engineer,programming
42,6 ChatGPT mind-blowing extensions to use it anywhere,programming
43,"Say Goodbye to Loops in Python, and Welcome Vectorization!",programming
44,How we reduced our annual server costs by 80% — from $1M to $200k — by moving away from AWS,programming
45,CodeGPT: The VSCode Extension with ChatGPT-Like Functionalities,programming
46,Top 10 Best Open Source Projects on GitHub 2023,programming
47,13 SQL Statements for 90% of Your Data Science Tasks,programming
48,9 Projects You Can Do to Become a Front-End Master in 2023,programming
49,I Spent 14 Days Studying A Programmer Who Built a $167 B Company — Here Are His Weird Rules To Build a Startup,programming
50,Why I Keep Failing Candidates During Google Interviews…,programming
51,AutoGPT is Taking Over the Internet: Here Are the Incredible Use Cases That Will Blow Your Mind,programming
52,The Difference Between The Clever Developer & The Wise Developer,programming
53,The Architecture of a Modern Startup,programming
54,Getting Started with LangChain: A Beginner’s Guide to Building LLM-Powered Applications,programming
55,"It’s 2022, Please Don’t Just Use “console.log” Anymore",programming
56,My Top 5 Paid Subscriptions I’ll Never Cancel as a Programmer,programming
57,Top 8 Algorithms Every Programmer Should Know 💯,programming
58,5 Python Automation Scripts I Use Every Day,programming
59,"Don’t Run Loops in Python, Instead, Use These!",programming
60,5 Python Decorators I Use in Almost All My Data Science Projects,programming
61,17 Killer GitHub Repos You Need to Save Right Now!,programming
62,Python 3.14 Will be Faster than C++,programming
63,The 5 paid subscriptions I actually use in 2023 as a software engineer,programming
64,Goodbye Node JS,programming
65,Today’s Software Developers Will Stop Coding Soon,programming
66,"60 ChatGPT Prompts for Data Science (Tried, Tested, and Rated)",programming
67,GPT4All: Running an Open-source ChatGPT Clone on Your Laptop,programming
68,"Hey ChatGPT, Automate These Tasks Using Python",programming
69,The most important Linux commands that nobody teaches you.,programming
70,Advice From a Software Engineer With 8 Years of Experience,programming
71,REST vs GraphQL vs gRPC,programming
72,12 Python Decorators to Take Your Code to the Next Level,programming
73,10 Open-Source Projects For Web Developers In 2023,programming
74,How a Simple Script Helped Make Me over $1000/month,programming
75,12 Websites You’ll Love As A Developer,programming
76,I Spent 7 Months Gathering The Very Best Free Courses I Could Find On The Internet,programming
77,Goodbye Excel. Hello Spreadsheets in Python!,programming
78,Don’t Just LeetCode; Follow the Coding Patterns Instead,programming
79,7 Architecture Design Patterns — You wish you knew before interview,programming
80,"Three Programmers Turned a Dating Website Into a $1,650,000,000 Product in 2 Years Beating Google and Microsoft",programming
81,9 Python Built-In Decorators That Optimize Your Code Significantly,programming
82,10 Exciting Project Ideas Using Large Language Models (LLMs) for Your Portfolio,programming
83,10 Must-Read Books for Software Engineers in 2023,programming
84,The Inequitable Reality of Being a Programmer: Exploring the Unfair Advantage,programming
85,5 Python Projects to Automate Your Life: From Beginner to Advanced,programming
86,Meet Julia: The Future of Data Science,programming
87,How to Make Money with Web Scraping Using Python,programming
88,2 Regrets of a 55 Years Old Retired Software Engineer,programming
89,Instagram System Design,programming
90,I am a bad software developer and this is my life,programming
91,System Design Interview Survival Guide (2023): Preparation Strategies and Practical Tips,programming
92,5 Python Tricks That Distinguish Senior Developers From Juniors,programming
93,Introducing IceCream: Never Use Print() To Debug Your Python Code Again,programming
94,Small Python script that’ll keep you “online” all day,programming
95,System Design Master Template: How to Answer Any System Design Interview Question.,programming
96,GraphQL: From Excitement to Deception,programming
97,ChatGPT Will Replace Programmers Within 10 Years,programming
98,Why Experienced Programmers Fail Coding Interviews,programming
99,Enhancing ChatGPT With Infinite External Memory Using Vector Database and ChatGPT Retrieval Plugin,programming
100,🔥 Mastering TypeScript: 20 Best Practices for Improved Code Quality,programming
101,"I Needed Money, So I Started QData Trading",programming
102,11 Amazing New JavaScript Features in ES13,programming
103,Automate WhatsApp Messages with Python in 3 Steps,programming
104,Answering Question About your Documents Using LangChain (and NOT OpenAI),programming
105,"The Best Engineers Think Like Investors, Not Builders",programming
106,5 Ways to Avoid React Component Re-Renderings,programming
107,"A Programmer Turned an Open Source Tool Into a $7,500,000,000 Empire",programming
108,9 Fabulous Python Tricks That Make Your Code More Elegant,programming
109,How to Easily Convert a Python Script to an Executable File (.exe),programming
110,A Simple Guide to OpenAI API with Python,programming
111,It’s Time to Say GoodBye to pd.read_csv() and pd.to_csv(),programming
112,4 Automation Projects in Python You Can Finish in a Weekend,programming
113,I Found a Loophole to (Successfully) Web Scrape Using ChatGPT. Here’s How it Works,programming
114,ChatGPT Hype Is Proof Nobody Really Understands AI,programming
115,Laptop development is dead: why remote development is the future,programming
116,Bad Bad UX: 20 Common Mistakes in User Experience,programming
117,Hypermodern Python Toolbox,programming
118,"Node.js is Aging Like Milk, Now What’s Next?",programming
119,Fundamental Software Architectural Patterns,programming
120,"After 16 years at Google, Justin Moore was fired with an automated email",programming
121,Why an Engineering Manager Should Not Review Code,programming
122,OpenAI /ChatGPT— How to Use it With Python,programming
123,How To Update Your Status During Standup Like a Senior Engineer,programming
124,Programming Languages NOT To Learn In 2023!,programming
125,A 5 years+ tech lead said they shard a database to scale but then he failed to answer this question,programming
126,10 Common Software Architectural Patterns in a nutshell,programming
127,Doing much better than your .env file,programming
128,"Yes, Python Has a Built-In Database. Here’s How to Use It.",programming
129,16 Python Tricks To Learn Before You Write Your Next Code,programming
130,5 Signs You've Become an Advanced Pythonista Without Even Realizing It,programming
131,The Only 30 Methods You Should Master To Become A Pandas Pro,programming
132,Stop doing Token Auth in the Frontend,programming
133,Interviewer: Can (a==1 && a==2 && a==3) Ever Evaluate to ‘true’ in JavaScript?,programming
134,6 AI Tools That Will Make Your Life Easier (Other Than ChatGPT),programming
135,"Don’t use loc/iloc with Loops In Python, Instead, Use This!",programming
136,Solution Architecture: Docs-as-code,programming
137,Advanced JavaScript Concepts that Helped Me Get Better at Coding,programming
138,How to Make Money While Learning Data Science in 2023,programming
139,All JavaScript and TypeScript Features of the last 3 years,programming
140,AutoGPT: The New Kid on the AI Block That’s Changing Everything!,programming
141,Demotivating a (Skilled) Programmer,programming
142,Our Company Fired the Best Developer and Project Manager,programming
143,Node.js Developer Roadmap 2023,programming
144,Pandas Illustrated: The Definitive Visual Guide to Pandas,programming
145,I Used GPT-3 to Find 213 Security Vulnerabilities in a Single Codebase,programming
146,Java 19 Is A Game Changer,programming
147,20 advanced coding projects to expose you to complex concepts,programming
148,Agile Projects Have Become Waterfall Projects With Sprints,programming
149,15 fundamental tips on REST API design,programming
150,Why Google Employees Don’t Work,programming
151,Build custom-informed GPT-3-based chatbots for your website with very simple code,programming
152,The 7 Signs of a Bad Programmer,programming
153,ChatGPT and Software Architecture,programming
154,"Forget about SQLite, Use DuckDB Instead — And Thank Me Later",programming
155,4 React Tips to Instantly Improve Your Code,programming
156,Pandas vs. Polars: A Syntax and Speed Comparison,programming
157,Mindmaps using ChatGPT and PlantUML,programming
158,Say bye bye to bad javascript practices,programming
159,$5000 Per Hour Web Scraping Legal Site,programming
160,Goodbye os.path: 15 Pathlib Tricks to Quickly Master The File System in Python,programming
161,6 Underdog Data Science Libraries That Deserve Much More Attention,programming
162,11 Advanced React Interview Questions you should absolutely know (with detailed answers),programming
163,The Easiest Ways to Generate a Side Income with Python,programming
164,Don’t Start Your SQL Queries with the ‘Select’ Statement,programming
165,I Asked ChatGPT How to Become a Millionaire as a Developer,programming
166,How to Practice LeetCode Problems (The Right Way),programming
167,Elon Musk just force-ranked Twitter engineers & fired the bottom.,programming
168,Why I Will Never Use Alpine Linux Ever Again,programming
169,PandasGUI — The Ultimate Secret to Effortless Data Analysis,programming
170,"If You Ask These 4 Python Questions, You Might Still Be a Nooby",programming
171,Creating Your Own AI-Powered Second Brain: A Guide with Python and ChatGPT,programming
172,"Don’t Run Loops in Python, Instead, Use These!",programming
173,My Boss: Front-end Development Will be Replaced 100% by AI,programming
174,15 Fun and Interesting APIs to use for your next coding project in 2022,programming
175,Applying SOLID principles in React,programming
176,The Erosion of the Status of Software Developers as Professionals,programming
177,10 Hottest New Apps in January 2023 — ProductHunt Most Upvoted 🏆,programming
178,10 websites that pay you up to $1000 to start your technical writing journey.,programming
179,How I Used ChatGPT To Automate These 6 Tasks In My Data Science Role,programming
180,Kotlin is the Future of Back-end Development.,programming
181,Using ChatGPT to learn SQL,programming
182,Top 10 programming books to read in 2022,programming
183,Programming Languages NOT To Learn In 2023!,programming
184,Top 10 programming books to read in 2022,programming
185,"30 year old code killed! Microsoft rewrites Windows kernel with 180,000 lines of Rust",programming
186,Highest Paying Programming Languages for Software Engineers,programming
187,The Programming Language(s) of the Future,programming
188,A Sign You Are Not A Beginner Programmer Anymore,programming
189,My top 3 programming languages to learn in 2023,programming
190,"Amazon posts article on Rust, Go tech lead: don’t “pull the plug” on us",programming
191,I Don’t Give a F⋆⋆⋆ About S.O.L.I.D Principles — Here Are My Reasons,programming
192,Google Carbon vs. Apple Swift,programming
193,What Are the Greenest Programming Languages?,programming
194,Should you Use Constructor or Factory Method?,programming
195,Don’t Learn “Netflix” Programming Languages,programming
196,Context: The Missing Feature of Programming Languages,programming
197,Introduction to Prolog: A Programming Language for Artificial Intelligence,programming
198,The Most Used Design Patterns in .NET Development,programming
199,Quick Guide: Go 1.19 Features,programming
200,C++23 Is Finalized. Here Comes C++26,programming
201,Everything you need to learn TypeScript in just 4 minutes,programming
202,I bet you didn’t know about these features in Kotlin,programming
203,Why the Rust Community Should Be Worried About the New Carbon Language,programming
204,ARE THESE ELEVEN PROGRAMMING LANGUAGES STILL ALIVE ?,programming
205,7 ways to remove duplicates from an array in JavaScript,programming
206,11 Best Android Libraries for 2022,programming
207,5 programming languages we can see being born right now,programming
208,The Two Cultures of Programming: Why Both Are Important,programming
209,Top Tech Stacks 💻 to Consider for Your Software Project,programming
210,Go Channels — The Ultimate Guide,programming
211,When Should You Use Pointers in Golang,programming
212,Don’t Learn a Programming Language. Learn Software Engineering,programming
213,"No, C# Is Not Dying. But No Language Lives Forever",programming
214,How ChatGPT Increased My Coding Efficiency in Everyday Work,programming
215,Which programming language should you learn in 2022?,programming
216,Google’s new experimental programming language: Carbon,programming
217,Reliable software engineering with Rust,programming
218,Top Programming Languages Used by Startups,programming
219,Why Python is not the programming language of the future,programming
220,Will Julia Replace Python as a Programming Language in the Future?,programming
221,Java Enum polymorphism pattern,programming
222,Most Difficult Java Interview Questions — Language Fundamentals,programming
223,HOW to LEARN coding from ZERO to HERO!,programming
224,You Won’t Learn to Code If You Do These 5 Things,programming
225,Golang Naming Conventions,programming
226,Create Bump Charts With Matplotlib,programming
227,7 Best Programming Books of All Time,programming
228,AM I A PROGRAMMER?,programming
229,What Makes LISP Unique?,programming
230,How to use Python classes effectively,programming
231,My top Python IDEs for iPad,programming
232,Simple Trick to Improve Your Classes in PHP,programming
233,What does the startup that chose to use Go and Rust for its database seven years ago say about that decision today?,programming
234,After one year of Rust,programming
235,A Comprehensive Guide to Build Application with Python,programming
236,Why Dart May Be The Most Important Language In Programming,programming
237,Generate Pencil Sketch from Photo in Python,programming
238,Naming Conventions in Go: Short but Descriptive,programming
239,What Makes Julia Unique?,programming
240,Rust as Your Teacher,programming
241,9 Best Programming Blogs and Websites to Learn to Code,programming
242,5 Books for competitive programming every techie must read,programming
243,Working With OpenTelemetry and Golang,programming
244,What languages does Amazon use internally for programming?,programming
245,Rethinking Programming With Rust,programming
246,The Latest .NET 7 Features Will Change the Way You Code,programming
247,"C, C++, Rust, Python, and Carbon (When to use Which?)",programming
248,Building a custom Configuration Provider in .NET 6,programming
249,5 (Surgical) Tips to Program More Efficiently in C#💉,programming
250,"Cloud, why so difficult? 🤷‍♀️",programming
251,Functional Programming in Typescript,programming
252,Ruby modules: Include vs Prepend vs Extend,programming
253,The 114 standard C++ algorithms. Introduction,programming
254,Golang Concurrency — Worker Pool,programming
255,Programming Languages to Avoid and Learn in 2022.,programming
256,Rust vs C++: An in-depth language comparison,programming
257,What Symbols are Basically Used in Programming?,programming
258,Writing a simple Lisp interpreter in Rust,programming
259,A Love Letter to C’s Square Brackets,programming
260,6 Best Programming Languages for Game Development in 2023,programming
261,F# is the .NET Rust,programming
262,C++20 Modules — Complete Guide,programming
263,C++20 Ranges — Complete Guide,programming
264,Flyweight Pattern in Go,programming
265,Why I Like Go’s Error Handling,programming
266,The Top 5 Programming Languages for Newbies in 2023,programming
267,Writing a Parser — Part I: Getting Started,programming
268,The Internals of Go Channels,programming
269,astmaker — A DSL in Rust for programming language designers,programming
270,Bored of Python? Nim is coming to your rescue,programming
271,Mediator Pattern in Go,programming
272,The Zig and Go Programming Showdown!,programming
273,"Dart 3.0 Records are great, but why do we need them anyway?",programming
274,Advanced SQL,programming
275,Is Julia actually right for you?,programming
276,Use of double braces in Java Programming,programming
277,CompletableFuture : A Simplified Guide to Async Programming,programming
278,Singleton Pattern in Go,programming
279,ChatGPT and the future of software engineering,programming
280,C# vs. Java: which is the best programming language for performance?,programming
281,From Zero Programming experience to a Full Stack Developer,programming
282,Iterator Pattern in Go,programming
283,"Weird programming operators: Elvis, Walrus, Spaceship, and Turbofish!",programming
284,Introduction to Mojo: The Programming Language for AI Which Is 35000x Faster Than Python,programming
285,Celebrating 50 Years of Smalltalk,programming
286,Create a Golang Lib,programming
287,Why Functional Programming Languages Have No Loops?,programming
288,Mutex For Kotlin Coroutines,programming
289,Mastering Java: Tips and Best Practices for Increased Productivity,programming
290,Adapter Pattern in Go,programming
291,It’s 2023 and WebAssembly is Still Not Ready. Or is It?,programming
292,Different Ways To Count Unique Values In R,programming
293,Warp: A New Terminal To Boost Developer Productivity,programming
294,Initialize MySQL database inside the docker container with large-volume data,programming
295,Principles that developers should know,programming
296,Implementing gRPC with Golang,programming
297,Python Criticism from a Julia Perspective,programming
298,"Java Garbage Collection: What is the young generation, old generation, and permanent generation?",programming
299,LINQ — How to avoid nested loops in C#,programming
300,Go Generics: Everything You Need To Know,programming
301,Strategy Pattern in Go,programming
302,Rust in the real world: Write a CLI to perform load testing using Tokio,programming
303,Bye-bye Python. Hello Julia!,programming
304,5 Golang Code Snippets for Cybersecurity,programming
305,The Best C++ Books to Study in 2023,programming
306,How to install Golang (latest version) on Kali Linux,programming
307,Why a lot of developers are leaving Python?,programming
308,Best Resources to Learn Data Analytics & Science,programming
309,"Rust for Linux is coming, and what that means for us ?",programming
310,Tidyverse vs. Base-R: How To Choose The Best Framework For You,programming
311,"If You Are Learning Golang, Remember These 10 Commands",programming
312,I created a programming language and created games with it,programming
313,Why Bash Scripting Can Make You A Better Engineer,programming
314,How to Calculate Square and Square Root in Java?,programming
315,Object-oriented programming with Python: core principles and examples,programming
316,Creating an in-memory cache for .NET 6 Web API,programming
317,Kotlin also has the === operator. What does this mean?,programming
318,Why Flutter Uses Dart,programming
319,Rust 101 — Everything you need to know about Rust,programming
320,C++20 Coroutines — Complete* Guide,programming
321,5 Reasons Go Will Take Over the Programming World,programming
322,The most important Linux commands that nobody teaches you.,programming
323,10 New DevOps Tools to Watch in 2023,programming
324,Solution Architecture: Docs-as-code,programming
325,Using ChatGPT for DevOps,programming
326,10 websites that pay you up to $1000 to start your technical writing journey.,programming
327,15 DevOps and SRE Tools you Should Know About in 2023,programming
328,No one should write Terraform,programming
329,4 container design patterns for Kubernetes,programming
330,6 Linux Utilities You Should Install Right Now,programming
331,Using ChatGPT to Create AWS Cloudformation & Terraform Templates,programming
332,My top 10 Linux commands for debugging server issue,programming
333,"Terraform tips & tricks: loops, if-statements, and gotchas",programming
334,Will Modular Monolith Replace Microservices Architecture?,programming
335,Linux Cheatsheet for DevOps ♾,programming
336,8 Advanced Git Commands Universities Won’t Teach You,programming
337,10 Apps For Your Homelab In 2022,programming
338,The Right Way to Run Shell Commands From Python,programming
339,Top 7+ Kubernetes interview questions for experienced professionals | Part-1,programming
340,How to manage multiple environments with Terraform using workspaces,programming
341,Build a Kubernetes Operator in 10 Minutes,programming
342,"Alpine, Slim, Stretch, Buster, Jessie, Bullseye — What are the Differences in Docker Images?",programming
343,7 Productivity tools every DevOps Engineer needs to consider,programming
344,17 Best DevOps Tools to Use in 2022 for Infrastructure Automation and Monitoring,programming
345,10 Books Every Senior Engineer Should Read,programming
346,The ONLY 4 Skills You Need to Master Devops/Cloud,programming
347,How I reduced the size of my Docker Image by 95%,programming
348,Kubernetes Infrastructure At Medium,programming
349,A comprehensive guide to managing secrets in your Terraform code,programming
350,Microservices Best Practices,programming
351,Tracing pod to pod network traffic in Kubernetes,programming
352,Creating a Linux service with systemd,programming
353,Comparing the Top Eight Managed Kubernetes Providers,programming
354,K8s — ChatGPT Bot For Intelligent Troubleshooting,programming
355,6 kubectl plugins you must try,programming
356,Top 20 Kubernetes Interview Questions !!!.,programming
357,How Platform Engineering Differ from DevOps and SRE,programming
358,The 10 Platform Engineering Tools To Use in 2022,programming
359,Stop messing up with Git. Follow this simple and effective strategy to maintain Git branches.,programming
360,"ChatGPT for DevOps: Best Practices, Use Cases, and Warnings.",programming
361,Stop using Alpine Docker images,programming
362,"Introducing Patcher, a new tool for keeping infrastructure code up-to-date!",programming
363,Kubernetes Basics Cheatsheet,programming
364,All Major Software Architecture Patterns Explained,programming
365,How to run Ubuntu 22.04 VMs on Apple M1 ARM-based systems for free,programming
366,CPU limits and requests in Kubernetes,programming
367,Platform Engineering: Creating your Internal Developer Platform (Part 2),programming
368,Multi-tenancy in Kubernetes,programming
369,5 Beautiful Programs That Will Make Your Terminal More Exciting,programming
370,Infrastructure as Code is Not the Answer!,programming
371,5 Bash Coding Techniques That Every Programmer Should Know,programming
372,[DevOps] 01 - Example project with Terraform,programming
373,5 New CNCF Projects To Watch In 2023,programming
374,Domain-Driven Design for Microservices,programming
375,How do you gracefully shut down Pods in Kubernetes?,programming
376,Mac Tools I’m Using in 2022,programming
